"Status","Start Time","Stop Time","Duration in ms","Parent Suite","Suite","Sub Suite","Test Class","Test Method","Name","Description"
"passed","Tue Jul 25 15:50:30 GMT 2023","Tue Jul 25 15:50:44 GMT 2023","13465","Surefire suite","Surefire test","tests.MultiConfigurationProjectTest","tests.MultiConfigurationProjectTest","testSetContentInThreeBuildStepsBuildStatusOnGitHubCommitSaved","testSetContentInThreeBuildStepsBuildStatusOnGitHubCommitSaved","Verify that can  set content in three build steps and successfully saved"
"passed","Tue Jul 25 15:51:03 GMT 2023","Tue Jul 25 15:51:05 GMT 2023","1385","Surefire suite","Surefire test","tests.NewItemTest","tests.NewItemTest","testCreateMultibranchPipelineWithExistingName","testCreateMultibranchPipelineWithExistingName","Check if multibranch pipeline can be created with name, that is a name of already existing project"
"passed","Tue Jul 25 15:48:12 GMT 2023","Tue Jul 25 15:48:12 GMT 2023","231","Surefire suite","Surefire test","tests.FolderTest","tests.FolderTest","testConfigureFolderDisplayNameSaveFolderName","testConfigureFolderDisplayNameSaveFolderName","Verify that the previously changed folder name is saved"
"passed","Tue Jul 25 15:43:02 GMT 2023","Tue Jul 25 15:43:05 GMT 2023","2463","Surefire suite","Surefire test","tests.PipelineTest","tests.PipelineTest","testRenamePipelineUsingSpecialCharacter","testRenamePipelineUsingSpecialCharacter","Verify 'Error' page is displayed and '‘<spChar>’ is an unsafe character' error message is displayed if rename pipeline using special character"
"unknown","Tue Jul 25 15:40:04 GMT 2023","Tue Jul 25 15:40:04 GMT 2023","0","Surefire suite","Surefire test","tests.ViewsTest","tests.ViewsTest","testListViewAddRegexFilterJobNamesContainingNine","testListViewAddRegexFilterJobNamesContainingNine",""
"passed","Tue Jul 25 15:48:21 GMT 2023","Tue Jul 25 15:48:23 GMT 2023","1223","Surefire suite","Surefire test","tests.FolderTest","tests.FolderTest","testCreateFolderWithDescription","testCreateFolderWithDescription","Verify the ability to create a new folder with description"
"passed","Tue Jul 25 15:44:17 GMT 2023","Tue Jul 25 15:44:20 GMT 2023","2482","Surefire suite","Surefire test","tests.OrganizationFolderTest","tests.OrganizationFolderTest","testDeleteOrganizationFolderDependsMethods","testDeleteOrganizationFolderDependsMethods","Verify that the 'Organization Folder' can be deleted with the 'Delete' on the side menu"
"passed","Tue Jul 25 15:47:23 GMT 2023","Tue Jul 25 15:47:30 GMT 2023","6623","Surefire suite","Surefire test","tests.ManageJenkinsTest","tests.ManageJenkinsTest","testSetSystemMessage","testSetSystemMessage","Add a system message to the Jenkins configuration and verify that this message is displayed on the dashboard and on the folder status page"
"unknown","Tue Jul 25 15:40:04 GMT 2023","Tue Jul 25 15:40:04 GMT 2023","0","Surefire suite","Surefire test","tests.FreestyleProjectTest","tests.FreestyleProjectTest","testDeleteFreestyleProject","testDeleteFreestyleProject","Verify deletion of the project using side menu"
"passed","Tue Jul 25 15:44:26 GMT 2023","Tue Jul 25 15:44:29 GMT 2023","2873","Surefire suite","Surefire test","tests.OrganizationFolderTest","tests.OrganizationFolderTest","testRenameOrganizationFolder","testRenameOrganizationFolder","Verify that the 'Organization Folder' can be renamed"
"passed","Tue Jul 25 15:47:20 GMT 2023","Tue Jul 25 15:47:22 GMT 2023","1965","Surefire suite","Surefire test","tests.ManageJenkinsTest","tests.ManageJenkinsTest","testRenameFullUserName","testRenameFullUserName","Rename 'Full Name' for User with valid characters and verity that New Full Name is displayed on StatusUserPage and on Header and on Breadcrumbs"
"passed","Tue Jul 25 15:46:53 GMT 2023","Tue Jul 25 15:46:56 GMT 2023","2824","Surefire suite","Surefire test","tests.ManageJenkinsTest","tests.ManageJenkinsTest","testIsEmailPluginInstalledAndEnabled","testIsEmailPluginInstalledAndEnabled","Verify that Email Extension Plugin is installed and enabled"
"passed","Tue Jul 25 15:46:46 GMT 2023","Tue Jul 25 15:46:49 GMT 2023","2950","Surefire suite","Surefire test","tests.ManageJenkinsTest","tests.ManageJenkinsTest","testDeleteUserGoingFromConfigureUserPage","testDeleteUserGoingFromConfigureUserPage","Delete user by 'Delete' on the side menu on the 'Configure user' page and verify that deleted user is not displayed on the 'People' page"
"passed","Tue Jul 25 15:50:45 GMT 2023","Tue Jul 25 15:50:45 GMT 2023","462","Surefire suite","Surefire test","tests.NewItemTest","tests.NewItemTest","testCheckNavigationToNewItemPage","testCheckNavigationToNewItemPage","Check if 'New Item' button on side menu navigates to NewItemPage"
"passed","Tue Jul 25 15:40:53 GMT 2023","Tue Jul 25 15:40:56 GMT 2023","3537","Surefire suite","Surefire test","tests.PeoplePageTest","tests.PeoplePageTest","testFindUserInThePeopleSection","testFindUserInThePeopleSection","Locate a newly created user within the 'People' section"
"unknown","Tue Jul 25 15:40:04 GMT 2023","Tue Jul 25 15:40:04 GMT 2023","0","Surefire suite","Surefire test","tests.FreestyleProjectTest","tests.FreestyleProjectTest","testCheckFieldsDaysAndMaxNumberOfBuildsToKeepInConfigure","testCheckFieldsDaysAndMaxNumberOfBuildsToKeepInConfigure","Verify if 'Days to keep builds' and 'Max # of builds to keep' settings of 'Discard old builds' are displayed upon saved"
"passed","Tue Jul 25 15:51:11 GMT 2023","Tue Jul 25 15:51:12 GMT 2023","1214","Surefire suite","Surefire test","tests.NewItemTest","tests.NewItemTest","testCreateNewFreestyleProjectWithLongNameFrom256Characters","testCreateNewFreestyleProjectWithLongNameFrom256Characters","Check if a new freestyle project with name from 256 characters can be created"
"passed","Tue Jul 25 15:45:33 GMT 2023","Tue Jul 25 15:45:35 GMT 2023","1641","Surefire suite","Surefire test","tests.ManageJenkinsTest","tests.ManageJenkinsTest","testCreateUserWithEmptyConfirmPassword","testCreateUserWithEmptyConfirmPassword","Try to create user with empty 'Confirm password' field and verify that error message 'Password didn't match' appeared"
"passed","Tue Jul 25 15:43:12 GMT 2023","Tue Jul 25 15:43:15 GMT 2023","2428","Surefire suite","Surefire test","tests.PipelineTest","tests.PipelineTest","testRenamePipelineUsingSpecialCharacter","testRenamePipelineUsingSpecialCharacter","Verify 'Error' page is displayed and '‘<spChar>’ is an unsafe character' error message is displayed if rename pipeline using special character"
"passed","Tue Jul 25 15:49:07 GMT 2023","Tue Jul 25 15:49:09 GMT 2023","1820","Surefire suite","Surefire test","tests.FolderTest","tests.FolderTest","testRenameFolderFromDropDownMenuConfigure","testRenameFolderFromDropDownMenuConfigure","Verify that the name of the folder can be changed through 'Configure' dropdown menu"
"passed","Tue Jul 25 15:50:58 GMT 2023","Tue Jul 25 15:50:59 GMT 2023","1302","Surefire suite","Surefire test","tests.NewItemTest","tests.NewItemTest","testCreateMultibranchPipeline","testCreateMultibranchPipeline","Check if a new multibranch pipeline can be created"
"passed","Tue Jul 25 15:44:50 GMT 2023","Tue Jul 25 15:44:51 GMT 2023","550","Surefire suite","Surefire test","tests.HeaderComponentTest","tests.HeaderComponentTest","testUserDropdownMenuToOpenMyViewsUserPage","testUserDropdownMenuToOpenMyViewsUserPage","Verify if click on 'My views' link in the User dropdown menu leads to the views page that confirmed by 'My views' breadcrumb"
"passed","Tue Jul 25 15:42:22 GMT 2023","Tue Jul 25 15:42:24 GMT 2023","1305","Surefire suite","Surefire test","tests.PipelineTest","tests.PipelineTest","testPipelinePreviewDescription","testPipelinePreviewDescription","Verify the preview of description is displayed if fill out a description in the field of pipeline"
"passed","Tue Jul 25 15:49:36 GMT 2023","Tue Jul 25 15:49:38 GMT 2023","2109","Surefire suite","Surefire test","tests.MultiConfigurationProjectTest","tests.MultiConfigurationProjectTest","testMultiConfigurationProjectDelete","testMultiConfigurationProjectDelete","Verify that the 'MultiConfigurationProject' can be renamed to project status page"
"passed","Tue Jul 25 15:46:24 GMT 2023","Tue Jul 25 15:46:26 GMT 2023","1834","Surefire suite","Surefire test","tests.ManageJenkinsTest","tests.ManageJenkinsTest","testCreateUserWithIncorrectCharactersInName","testCreateUserWithIncorrectCharactersInName","Try to create user with invalid characters in name and verify that error message 'User name must only contain alphanumeric characters, underscore and dash' appeared"
"passed","Tue Jul 25 15:44:47 GMT 2023","Tue Jul 25 15:44:48 GMT 2023","879","Surefire suite","Surefire test","tests.HeaderComponentTest","tests.HeaderComponentTest","testUserDropdownMenuToOpenConfigureUserPage","testUserDropdownMenuToOpenConfigureUserPage","Verify if 'Configure' link in the User dropdown menu leads to the expected page that contains 'Add new Token' section"
"passed","Tue Jul 25 15:42:09 GMT 2023","Tue Jul 25 15:42:11 GMT 2023","2120","Surefire suite","Surefire test","tests.PipelineTest","tests.PipelineTest","testDeletePipelineFromDashboard","testDeletePipelineFromDashboard","Verify deleted Pipeline name doesn’t exist on a dashboard page if delete Pipeline with a menu button"
"passed","Tue Jul 25 15:47:59 GMT 2023","Tue Jul 25 15:48:01 GMT 2023","1984","Surefire suite","Surefire test","tests.MultibranchPipelineTest","tests.MultibranchPipelineTest","testRenameMultiBranchPipelineFromDropdown","testRenameMultiBranchPipelineFromDropdown","Verify that 'Multibranch Pipeline' can be renamed from the drop-down menu"
"passed","Tue Jul 25 15:48:49 GMT 2023","Tue Jul 25 15:48:51 GMT 2023","1588","Surefire suite","Surefire test","tests.FolderTest","tests.FolderTest","testDeleteFolder","testDeleteFolder","Verify that the folder can be deleted"
"passed","Tue Jul 25 15:46:10 GMT 2023","Tue Jul 25 15:46:12 GMT 2023","1894","Surefire suite","Surefire test","tests.ManageJenkinsTest","tests.ManageJenkinsTest","testCreateUserWithIncorrectCharactersInName","testCreateUserWithIncorrectCharactersInName","Try to create user with invalid characters in name and verify that error message 'User name must only contain alphanumeric characters, underscore and dash' appeared"
"passed","Tue Jul 25 15:41:01 GMT 2023","Tue Jul 25 15:41:04 GMT 2023","2879","Surefire suite","Surefire test","tests.PeoplePageTest","tests.PeoplePageTest","testCreateUser","testCreateUser","Verify that new user was created"
"passed","Tue Jul 25 15:43:23 GMT 2023","Tue Jul 25 15:43:25 GMT 2023","2141","Surefire suite","Surefire test","tests.PipelineTest","tests.PipelineTest","testRenamePipelineUsingSpecialCharacter","testRenamePipelineUsingSpecialCharacter","Verify 'Error' page is displayed and '‘<spChar>’ is an unsafe character' error message is displayed if rename pipeline using special character"
"passed","Tue Jul 25 15:51:34 GMT 2023","Tue Jul 25 15:51:35 GMT 2023","534","Surefire suite","Surefire test","tests.NewItemTest","tests.NewItemTest","testCreateNewItemWithSpecialCharacterName","testCreateNewItemWithSpecialCharacterName","Verify that creating NewItem with special characters is not possible"
"passed","Tue Jul 25 15:46:05 GMT 2023","Tue Jul 25 15:46:07 GMT 2023","1917","Surefire suite","Surefire test","tests.ManageJenkinsTest","tests.ManageJenkinsTest","testCreateUserWithIncorrectCharactersInName","testCreateUserWithIncorrectCharactersInName","Try to create user with invalid characters in name and verify that error message 'User name must only contain alphanumeric characters, underscore and dash' appeared"
"passed","Tue Jul 25 15:50:48 GMT 2023","Tue Jul 25 15:50:48 GMT 2023","325","Surefire suite","Surefire test","tests.NewItemTest","tests.NewItemTest","testCreateFreestyleProjectWithEmptyName","testCreateFreestyleProjectWithEmptyName","Check if a new freestyle project with empty name can be created"
"passed","Tue Jul 25 15:40:51 GMT 2023","Tue Jul 25 15:40:52 GMT 2023","668","Surefire suite","Surefire test","tests.CopyItemTest","tests.CopyItemTest","testFieldCopyFromDoNotDisplayIfDoNotHaveAnyItems","testFieldCopyFromDoNotDisplayIfDoNotHaveAnyItems","Verify 'Copy from' field is not displayed when there are no items exist"
"passed","Tue Jul 25 15:45:26 GMT 2023","Tue Jul 25 15:45:28 GMT 2023","2356","Surefire suite","Surefire test","tests.ManageJenkinsTest","tests.ManageJenkinsTest","testCreateNewNodeWithValidNameFromDashboard","testCreateNewNodeWithValidNameFromDashboard","Create New Node by clicking on 'Build Executor Status' on Dashboard"
"passed","Tue Jul 25 15:40:56 GMT 2023","Tue Jul 25 15:40:58 GMT 2023","2216","Surefire suite","Surefire test","tests.PeoplePageTest","tests.PeoplePageTest","testPeopleDeleteUser","testPeopleDeleteUser","Verify that user was deleted"
"passed","Tue Jul 25 15:46:08 GMT 2023","Tue Jul 25 15:46:10 GMT 2023","1925","Surefire suite","Surefire test","tests.ManageJenkinsTest","tests.ManageJenkinsTest","testCreateUserWithIncorrectCharactersInName","testCreateUserWithIncorrectCharactersInName","Try to create user with invalid characters in name and verify that error message 'User name must only contain alphanumeric characters, underscore and dash' appeared"
"passed","Tue Jul 25 15:50:51 GMT 2023","Tue Jul 25 15:50:53 GMT 2023","1888","Surefire suite","Surefire test","tests.NewItemTest","tests.NewItemTest","testCreateMultiConfigurationProjectWithDescription","testCreateMultiConfigurationProjectWithDescription","Check if multi-configuration project can be created with description"
"passed","Tue Jul 25 15:41:43 GMT 2023","Tue Jul 25 15:41:45 GMT 2023","2026","Surefire suite","Surefire test","tests.PipelineTest","tests.PipelineTest","testBuildNewPipeline","testBuildNewPipeline","Verify last Success text is 'N/A' if build with sample 'Hello World'"
"passed","Tue Jul 25 15:44:56 GMT 2023","Tue Jul 25 15:44:57 GMT 2023","533","Surefire suite","Surefire test","tests.BuildHistoryTest","tests.BuildHistoryTest","testIconLegendExist","testIconLegendExist","Verify that the 'Icon Legend' exist on the 'Build History' page"
"passed","Tue Jul 25 15:48:13 GMT 2023","Tue Jul 25 15:48:14 GMT 2023","1204","Surefire suite","Surefire test","tests.FolderTest","tests.FolderTest","testCreateFolder","testCreateFolder","Verify the ability to create a new folder for organizing items"
"passed","Tue Jul 25 15:42:41 GMT 2023","Tue Jul 25 15:42:44 GMT 2023","2488","Surefire suite","Surefire test","tests.PipelineTest","tests.PipelineTest","testRenamePipelineUsingSpecialCharacter","testRenamePipelineUsingSpecialCharacter","Verify 'Error' page is displayed and '‘<spChar>’ is an unsafe character' error message is displayed if rename pipeline using special character"
"passed","Tue Jul 25 15:51:26 GMT 2023","Tue Jul 25 15:51:27 GMT 2023","528","Surefire suite","Surefire test","tests.NewItemTest","tests.NewItemTest","testCreateNewItemWithSpecialCharacterName","testCreateNewItemWithSpecialCharacterName","Verify that creating NewItem with special characters is not possible"
"passed","Tue Jul 25 15:42:31 GMT 2023","Tue Jul 25 15:42:34 GMT 2023","2540","Surefire suite","Surefire test","tests.PipelineTest","tests.PipelineTest","testRenamePipelineUsingSpecialCharacter","testRenamePipelineUsingSpecialCharacter","Verify 'Error' page is displayed and '‘<spChar>’ is an unsafe character' error message is displayed if rename pipeline using special character"
